{"schemaVersion":1,"reviewRecordId":"review-1","executionId":"execution-1","reviewer":{"type":"fixture","identity":"fresh-reviewer","adapter":"fixture"},"attestation":{"ref":"fixture-attestation","nonInteractive":true,"isolatedContext":true,"freshContext":true,"readOnly":true},"assuranceLevel":"strict-isolated","baseCommit":"aaaaaaaaaaaaaaaaaaaaaaaaaaaaaaaaaaaaaaaa","headCommit":"bbbbbbbbbbbbbbbbbbbbbbbbbbbbbbbbbbbbbbbb","manifestDigest":"dddddddddddddddddddddddddddddddddddddddddddddddddddddddddddddddd","startedAt":"2026-08-12T10:00:00.000Z","completedAt":"2026-08-12T10:01:00.000Z","findings":[],"status":"passed","unavailableCode":""}
